{
  "id": "00000000-0000-4000-8000-000000000001",
  "task": "Синтетический пример: проверить формат записи без добавления в настоящий журнал.",
  "before": "Синтетические исходные данные; живые службы и клиентские записи не используются.",
  "actions": "Передать этот объект только в validate(record) и JSON Schema validator.",
  "checks": "Проверить поля, UUID, ограничения текста, null SHA и boolean; не вызывать start, append или run.",
  "result": "Это пример формата, не свидетельство реальной проверки или выпуска.",
  "git_sha": null,
  "release_required": false,
  "state": "Синтетическое полное состояние: пример проверяет только формат. Прочие условные открытые вопросы и ограничения сохранены; готовность живых служб не утверждается."
}
